priority_id;country_or_system;source_id;source_title;source_type;official_source_url;priority_level;reason_for_priority;mechanisms_or_rights_covered;expected_tables_to_feed;download_format;conversion_complexity;metadata_risk;vigency_risk;recommended_next_action;target_folder;proposed_md_filename;notes
CR-08;costa_rica;CR_TSE_JURISP;TSE Costa Rica — Jurisprudencia y Resoluciones (compilación temática: mecanismos de participación directa);jurisprudence_compilation;https://www.tse.go.cr/jurisprudencia.htm;P1;El TSE tiene jurisdicción exclusiva para interpretar la ley electoral. Sus resoluciones sobre referéndum | iniciativa | derechos de partidos son vinculantes. Esencial para jurisprudence_standards y barrier_typology;referendum | popular_initiative | party_rights | candidate_eligibility | gender_parity | electoral_interpretation;corpus_index | jurisprudence_standards | activation_standards | barrier_typology | comparative_mapping;pdf_or_html;high;low;medium;download_thematic_compilation — Buscar en base de datos de jurisprudencia del TSE resoluciones sobre: (1) referéndum Art. 105 (2) iniciativa popular Ley 8491 (3) activación de mecanismos directos (4) paridad. Descargar resoluciones relevantes;/Users/adelasantos/Documents/normtrace-politicalrights/01_sources/costa_rica/md/;costa_rica_tse_jurisprudencia_mecanismos_participacion.md;El TSE emitió resoluciones sobre constitucionalidad de preguntas de referéndum | alcance de la iniciativa popular | registro de partidos. Crítico para activation_standards y barrier_typology.
CR-09;costa_rica;CR_TSE_REG_INT;TSE — Reglamento de Organización y Servicio (Reglamento Interior del TSE);administrative_regulation;https://www.tse.go.cr/normativa.htm;P2;Define estructura interna del TSE y delegación de autoridad. Relevante para actors y actor_mechanism_edges (identificar qué unidad del TSE gestiona cada mecanismo);TSE_structure | institutional_competence;corpus_index | actors | actor_mechanism_edges;pdf;low;medium;medium;download_and_convert — Fase 2. Localizar en normativa del TSE;/Users/adelasantos/Documents/normtrace-politicalrights/01_sources/costa_rica/md/;costa_rica_tse_reglamento_interior.md;Fase 2. Verificar publicación en La Gaceta.
CR-10;costa_rica;CR_REG_ASAMBLEA;Reglamento de la Asamblea Legislativa de Costa Rica;internal_regulation;http://www.asamblea.go.cr/reglamento;P1;Regula el procedimiento interno de la Asamblea para el procesamiento de proyectos de ley incluyendo iniciativas ciudadanas. Define admisión | comisiones | trámite | audiencias públicas;popular_initiative | legislative_procedure | committee_referral | public_hearings;corpus_index | domestic_provisions | participation_mechanisms | activation_requirements | actors;pdf_or_html;low;low;medium;download_and_convert — Descargar desde sitio oficial de la Asamblea Legislativa;/Users/adelasantos/Documents/normtrace-politicalrights/01_sources/costa_rica/md/;costa_rica_asamblea_legislativa_reglamento.md;El reglamento define cómo la Asamblea procesa las iniciativas ciudadanas recibidas del TSE. Crítico para mapear el tramo legislativo del mecanismo de iniciativa popular.
CR-11;costa_rica;CR_SALA_IV_JURISP;Sala Constitucional (Sala IV) — Jurisprudencia sobre derechos políticos y mecanismos de participación;jurisprudence_compilation;https://nexuspj.poder-judicial.go.cr/;P1;La Sala IV ha resuelto sobre constitucionalidad de restricciones a derechos políticos | referéndum | paridad | exclusiones. Sus votos son vinculantes erga omnes. Esencial para jurisprudence_standards;referendum | popular_initiative | party_rights | political_rights_restrictions | gender_parity | electoral_remedies;corpus_index | jurisprudence_standards | barrier_typology | activation_standards | comparative_mapping;pdf_or_html;high;low;medium;download_thematic_compilation — Buscar en Nexus PJ (base de datos del Poder Judicial) votos sobre: referéndum (Art. 105) | derechos políticos | paridad | restricciones. Descargar votos clave con número de expediente;/Users/adelasantos/Documents/normtrace-politicalrights/01_sources/costa_rica/md/;costa_rica_sala_constitucional_jurisprudencia_derechos_politicos.md;Votos clave: Voto 2771-2003 (referéndum) | Voto 17555-2014 (paridad). La Sala IV tiene competencia de acción de inconstitucionalidad — sus resoluciones pueden anular normas electorales.
INT-01;international;INT_CADH_1969;Convención Americana sobre Derechos Humanos — Pacto de San José (1969);international_treaty;https://www.oas.org/dil/esp/tratados_b-32_convencion_americana_sobre_derechos_humanos.htm;P1;Tratado regional central. Art. 23 define derechos políticos (votar | ser elegido | acceso a cargos públicos | restricciones permitidas). México ratificó 1981. Costa Rica ratificó 1970. Base del estándar inter-americano para todo el análisis;right_to_vote | right_to_be_elected | access_to_public_service | political_rights_restrictions | non_discrimination;corpus_index | international_standards | activation_standards | comparative_mapping | barrier_typology;pdf_or_html;low;low;low;download_and_convert — Descargar texto oficial en español de la colección de tratados de la OEA;/Users/adelasantos/Documents/normtrace-politicalrights/01_sources/international_standards/md/;interamerican_convencion_americana_derechos_humanos_cadh_1969.md;Art. 23 mapea contra todos los mecanismos en scope. Art. 8 (garantías judiciales) y Art. 25 (protección judicial) también relevantes para remedios.
INT-02;international;INT_ICCPR_1966;Pacto Internacional de Derechos Civiles y Políticos — PIDCP (1966);international_treaty;https://www.ohchr.org/es/instruments-mechanisms/instruments/international-covenant-civil-and-political-rights;P1;Tratado universal. Art. 25 (votar | ser elegido | acceso a cargos) es la base del estándar ONU para derechos políticos. México y Costa Rica han ratificado. Art. 2(3) establece obligación de remedios efectivos;right_to_vote | right_to_be_elected | access_to_public_service | political_rights_scope | effective_remedy;corpus_index | international_standards | activation_standards | comparative_mapping;pdf_or_html;low;low;low;download_and_convert — Descargar texto oficial en español de OHCHR;/Users/adelasantos/Documents/normtrace-politicalrights/01_sources/international_standards/md/;un_pacto_internacional_derechos_civiles_politicos_pidcp_1966.md;México ratificó 1981. Costa Rica 1968. El Primer Protocolo Facultativo permite denuncias individuales. Art. 25 no es derogable bajo Art. 4 PIDCP.
INT-03;international;INT_CARTA_DEM_2001;Carta Democrática Interamericana (OEA — 2001);soft_law_standard;https://www.oas.org/charter/docs_es/resolucion1_es.htm;P1;Instrumento OEA que define elementos esenciales de la democracia representativa (Art. 3) | condiciones para el ejercicio de derechos políticos (Art. 2) | rol de la sociedad civil. Invocado en análisis de derechos políticos. México y Costa Rica son miembros de la OEA;representative_democracy | political_participation | free_fair_elections | civil_society | electoral_conditions;corpus_index | international_standards | comparative_mapping;pdf_or_html;low;low;low;download_and_convert — Descargar texto oficial en español de la OEA;/Users/adelasantos/Documents/normtrace-politicalrights/01_sources/international_standards/md/;oas_carta_democratica_interamericana_2001.md;Adoptada el 11 de septiembre de 2001. No es tratado vinculante pero es estándar político-jurídico autorizado de la OEA. Registrar legal_force como soft_law.
INT-04;international;INT_CORTEIDH_JURISP_ART23;Corte IDH — Jurisprudencia sobre derechos políticos (Art. 23 CADH) — casos clave;jurisprudence_compilation;https://www.corteidh.or.cr/tablas/fichas/politicos.pdf;P1;La CorteIDH es la máxima autoridad regional de interpretación del Art. 23 CADH. Casos clave: Castañeda Gutman v. México (2008) | Yatama v. Nicaragua (2005) | López Mendoza v. Venezuela (2011) | Petro Urrego v. Colombia (2020) | Chitay Nech v. Guatemala (2010). México y Costa Rica han aceptado jurisdicción contenciosa;candidaturas_independientes | political_rights_restrictions | electoral_remedies | indigenous_participation | political_sanctions | Art_23_CADH;corpus_index | jurisprudence_standards | activation_standards | barrier_typology | international_standards | comparative_mapping;pdf;high;low;low;download_and_convert_key_cases — Descargar sentencias completas individualmente desde corteidh.or.cr. Extraer puntos resolutivos y criterios clave. Castañeda Gutman directamente involucra a México;/Users/adelasantos/Documents/normtrace-politicalrights/01_sources/international_standards/md/;corteidh_jurisprudencia_derechos_politicos_art23_cadh.md;ALTA COMPLEJIDAD. Cada sentencia de la CorteIDH tiene 50-200 páginas. Estrategia: descargar PDFs completos a 01_sources/international_standards/pdf/ y extraer puntos resolutivos y criterios para el archivo MD. Castañeda Gutman v. México (2008) es directamente relevante — condujo a la reforma constitucional 2012 que introdujo candidaturas independientes.
INT-05;international;INT_DECL_AMER_1948;Declaración Americana de los Derechos y Deberes del Hombre (OEA — 1948);soft_law_standard;https://www.oas.org/es/cidh/mandato/documentos-basicos/declaracion-americana-de-los-derechos-y-deberes-del-hombre.pdf;P1;Instrumento pre-CADH. Art. XX establece derecho a votar y participar en gobierno. Art. XXXII establece deberes cívicos de votación. Tratada como vinculante por la CIDH para estados miembros de la OEA que no han ratificado la CADH;right_to_vote | political_participation | civic_duties;corpus_index | international_standards | comparative_mapping;pdf_or_html;low;low;low;download_and_convert — Documento breve. Descargar desde OEA;/Users/adelasantos/Documents/normtrace-politicalrights/01_sources/international_standards/md/;oas_declaracion_americana_derechos_deberes_hombre_1948.md;Documento breve. Como declaración (no tratado) tiene estatus soft-law pero la CIDH la trata como vinculante para estados miembros de la OEA.
INT-06;international;INT_OG25_1996;Observación General No. 25 del Comité de Derechos Humanos ONU — Derecho a participar en asuntos públicos (Art. 25 PIDCP);treaty_body_interpretation;https://www.ohchr.org/en/documents/general-comments-and-recommendations/ccpr-general-comment-no-25-article-25;P1;Interpretación definitiva de la ONU sobre el Art. 25 PIDCP. Define: alcance de los derechos de participación | restricciones permitidas | obligaciones estatales para mecanismos de democracia directa | condiciones para elecciones libres y justas. Mapea directamente a activation_standards;right_to_vote | right_to_be_elected | access_public_service | direct_democracy | permissible_restrictions | state_obligations;corpus_index | international_standards | activation_standards | comparative_mapping;pdf_or_html;low;low;low;download_and_convert — Descargar en español desde OHCHR;/Users/adelasantos/Documents/normtrace-politicalrights/01_sources/international_standards/md/;un_ccpr_observacion_general_25_art25_pidcp_1996.md;OG 25 adoptada en 1996. El Comité DH no ha emitido una OG actualizada sobre Art. 25. OG 25 permanece como la interpretación autorizada vigente.
INT-07;international;INT_CIDH_INFORME_PART;CIDH — Informe temático sobre participación política y democracia en las Américas (identificar el más reciente);soft_law_standard;https://www.oas.org/es/cidh/informes/tematicos.asp;P2;Los informes temáticos de la CIDH desarrollan estándares sobre participación política | barreras a la candidatura | paridad | participación indígena. Relevantes para barrier_typology y comparative_mapping;political_participation | barriers_to_candidacy | gender_parity | indigenous_rights | direct_democracy_standards;corpus_index | international_standards | barrier_typology | comparative_mapping;pdf;medium;low;low;identify_and_download — Identificar el informe temático más relevante sobre participación política/democracia directa en base de datos de informes temáticos de la CIDH. Extraer estándares operativos solamente;/Users/adelasantos/Documents/normtrace-politicalrights/01_sources/international_standards/md/;cidh_informe_tematico_participacion_politica.md;Fase 2 preferible. Identificar el informe más relevante antes de proceder. La CIDH ha emitido informes sobre: participación de mujeres | pueblos indígenas | observación electoral.
INT-08;international;INT_OG37_2020;Observación General No. 37 del Comité DH ONU — Derecho de reunión pacífica (Art. 21 PIDCP);treaty_body_interpretation;https://www.ohchr.org/en/documents/general-comments-and-recommendations/general-comment-no-37-2020-right-peaceful-assembly;P2;El derecho de reunión pacífica es precondición para la participación política efectiva y la movilización en procesos de democracia directa. OG 37 (2020) contiene estándares modernos sobre asamblea como precondición para participación política. Relevante para barrier_typology;right_of_assembly | political_participation | restrictions | state_obligations;corpus_index | international_standards | barrier_typology;pdf_or_html;low;low;low;download_and_convert — Fase 2. Descargar en español desde OHCHR;/Users/adelasantos/Documents/normtrace-politicalrights/01_sources/international_standards/md/;un_ccpr_observacion_general_37_derecho_reunion_pacifica_2020.md;Fase 2. OG 37 adoptada en julio 2020. Disponible en español en OHCHR.
INT-09;international;INT_OAS_CARTA_1948;Carta de la Organización de los Estados Americanos (1948 — con reformas);international_treaty;https://www.oas.org/es/sla/ddi/tratados_multilaterales_interamericanos_A-41_carta_OEA.asp;P2;Tratado fundacional de la OEA. Contiene obligaciones sobre democracia representativa y derechos políticos de los estados miembros. Instrumento de fondo para international_standards;representative_democracy | political_rights | OAS_obligations;corpus_index | international_standards;pdf_or_html;low;low;low;download_and_convert — Fase 2. Descargar texto oficial en español;/Users/adelasantos/Documents/normtrace-politicalrights/01_sources/international_standards/md/;oas_carta_organizacion_estados_americanos_1948.md;Fase 2. Menos operativamente relevante que la CADH y la Carta Democrática para las tablas NormTrace pero provee el marco normativo de membresía en la OEA.
